{
  "schema_version": 1,
  "contract": "content-post-artifact-v1",
  "agent": "content-lead",
  "status": "ok",
  "run": {
    "task_id": "n8n-run-20260508-001",
    "idempotency_key": "linkedin-2026-05-08",
    "workflow": "content-foundry-hitl-linkedin",
    "execution_mode": "automation",
    "execution_id": null,
    "parent_execution_id": null
  },
  "post": {
    "post_id": "cf-linkedin-2026-05-08-001",
    "version": 1,
    "parent_post_id": null,
    "correction_of": null,
    "channel": "linkedin",
    "content_type": "social_post",
    "status": "draft",
    "title": "LinkedIn launch post",
    "slug": "linkedin-launch-post"
  },
  "content": {
    "text": "LinkedIn post text.",
    "format": "plain_text",
    "summary": "Optional short summary.",
    "draft_path": "draft/linkedin/cf-linkedin-2026-05-08-001.md",
    "extensions": {
      "linkedin": {
        "hashtags": ["#automation", "#content"]
      }
    }
  },
  "approval": {
    "required": true,
    "state": "pending",
    "feedback": null,
    "reviewed_at": null
  },
  "obsidian": {
    "note_rel": "draft/linkedin/cf-linkedin-2026-05-08-001.md",
    "attachment_glob": "assets/linkedin/cf-linkedin-2026-05-08-001-*",
    "frontmatter_keys": ["post_id", "version", "channel", "status"]
  },
  "media": [
    {
      "asset_id": "cf-linkedin-2026-05-08-001-hero",
      "type": "image",
      "mime_type": "image/png",
      "path": "assets/linkedin/cf-linkedin-2026-05-08-001-hero.png",
      "file_name": "cf-linkedin-2026-05-08-001-hero.png",
      "alt_text": "Hero image",
      "sha256": null,
      "bytes": null,
      "status": "generated",
      "drive_file_id": null
    }
  ],
  "paths": {
    "workspace_root": "/home/n8n-runner/content-foundry",
    "manifest_path": ".cursor/artifacts/cf-linkedin-2026-05-08-001/v1/artifact.json",
    "audit_log_path": ".cursor/artifacts/cf-linkedin-2026-05-08-001/v1/events.jsonl",
    "draft_path": "draft/linkedin/cf-linkedin-2026-05-08-001.md",
    "staging_dir": "staging/linkedin/cf-linkedin-2026-05-08-001/v1",
    "archive_dir": "published/linkedin/cf-linkedin-2026-05-08-001"
  },
  "channel_constraints": {
    "max_text_chars": 3000,
    "required_media": false,
    "allowed_media_types": ["image", "video"]
  },
  "compat": {
    "legacy_article_id": null,
    "legacy_media_paths": [],
    "channel_assumed": false
  },
  "errors": []
}
