{
  "schema_version": 1,
  "contract": "content-post-artifact-v1",
  "agent": "content-lead",
  "status": "ok",
  "run": {
    "task_id": "fixture-instagram-001",
    "idempotency_key": "fixture-instagram-001",
    "workflow": "content-foundry-hitl-social",
    "execution_mode": "automation",
    "execution_id": null,
    "parent_execution_id": null
  },
  "post": {
    "post_id": "cf-instagram-fixture-001",
    "version": 2,
    "parent_post_id": "cf-instagram-fixture-001",
    "correction_of": 1,
    "channel": "instagram",
    "content_type": "social_post",
    "status": "draft",
    "title": "Fixture instagram title",
    "slug": "fixture-instagram-title"
  },
  "content": {
    "text": "Fixture instagram text.",
    "format": "plain_text",
    "summary": "Summary",
    "draft_path": "draft/instagram/cf-instagram-fixture-001-v2.md",
    "extensions": {
      "instagram": {
        "carousel": true
      }
    }
  },
  "approval": {
    "required": true,
    "state": "pending",
    "feedback": null,
    "reviewed_at": null
  },
  "obsidian": {
    "note_rel": "draft/instagram/cf-instagram-fixture-001-v2.md",
    "attachment_glob": "assets/instagram/cf-instagram-fixture-001-*",
    "frontmatter_keys": ["post_id", "version", "channel", "status"]
  },
  "media": [],
  "paths": {
    "workspace_root": "/home/n8n-runner/content-foundry",
    "manifest_path": ".cursor/artifacts/cf-instagram-fixture-001/v2/artifact.json",
    "audit_log_path": ".cursor/artifacts/cf-instagram-fixture-001/v2/events.jsonl",
    "draft_path": "draft/instagram/cf-instagram-fixture-001-v2.md",
    "staging_dir": "staging/instagram/cf-instagram-fixture-001/v2",
    "archive_dir": "published/instagram/cf-instagram-fixture-001"
  },
  "channel_constraints": {
    "max_text_chars": 2200,
    "required_media": true,
    "allowed_media_types": ["image", "video"]
  },
  "compat": {
    "legacy_article_id": "legacy-article-77",
    "legacy_media_paths": [],
    "channel_assumed": false
  },
  "errors": []
}
