{
  "schema_version": 1,
  "contract": "content-post-artifact-v1",
  "agent": "content-lead",
  "status": "ok",
  "run": {
    "task_id": "n8n-run-20260508-ig-001",
    "idempotency_key": "instagram-2026-05-08",
    "workflow": "content-foundry-hitl-social",
    "execution_mode": "automation",
    "execution_id": null,
    "parent_execution_id": null
  },
  "post": {
    "post_id": "cf-instagram-2026-05-08-001",
    "version": 1,
    "parent_post_id": null,
    "correction_of": null,
    "channel": "instagram",
    "content_type": "social_post",
    "status": "draft",
    "title": "Instagram carousel intro",
    "slug": "instagram-carousel-intro"
  },
  "content": {
    "text": "Instagram caption text.",
    "format": "plain_text",
    "summary": "Caption + carousel card plan.",
    "draft_path": "draft/instagram/cf-instagram-2026-05-08-001.md",
    "extensions": {
      "instagram": {
        "carousel": true,
        "slide_count": 4
      }
    }
  },
  "approval": {
    "required": true,
    "state": "pending",
    "feedback": null,
    "reviewed_at": null
  },
  "obsidian": {
    "note_rel": "draft/instagram/cf-instagram-2026-05-08-001.md",
    "attachment_glob": "assets/instagram/cf-instagram-2026-05-08-001-*",
    "frontmatter_keys": ["post_id", "version", "channel", "status"]
  },
  "media": [],
  "paths": {
    "workspace_root": "/home/n8n-runner/content-foundry",
    "manifest_path": ".cursor/artifacts/cf-instagram-2026-05-08-001/v1/artifact.json",
    "audit_log_path": ".cursor/artifacts/cf-instagram-2026-05-08-001/v1/events.jsonl",
    "draft_path": "draft/instagram/cf-instagram-2026-05-08-001.md",
    "staging_dir": "staging/instagram/cf-instagram-2026-05-08-001/v1",
    "archive_dir": "published/instagram/cf-instagram-2026-05-08-001"
  },
  "channel_constraints": {
    "max_text_chars": 2200,
    "required_media": true,
    "allowed_media_types": ["image", "video"]
  },
  "compat": {
    "legacy_article_id": null,
    "legacy_media_paths": [],
    "channel_assumed": false
  },
  "errors": []
}
